{
  "$schema_file": "../schemas/dogfood-record.schema.json",
  "schema": "dogfood_record",
  "schema_version": "0.1",
  "record_type": "run",
  "task_id": "devswitchboard-profile-refresh-without-reroute-014",
  "revision": 2,
  "authority": [
    "DevSwitchboard Dogfood #014 Approved Handoff Revision 1 remains the intent and execution-strategy authority",
    "Chat Task Profile route evaluation at task revision 2 returned CONTINUE_CURRENT_ROUTE",
    "Routing Recommendation Revision 2 is the post-refresh route evidence",
    "Exact baseline be96653d59135b7c851265e59acfc51c92defe6c"
  ],
  "approved_route": [
    "Reuse Approved Handoff Revision 1 requirement discovery, design, specification, intent, and execution-strategy authority",
    "Resume from the completed Codex Preflight and repository-grounded implementation-planning checkpoint",
    "Routing Recommendation Revision 2: phase implementation; surface codex; matched rule R001; workflow approved_architectural_sequential_implementation",
    "Routing Recommendation Revision 2: implementation subagents false; workspace isolation true; fresh independent review required; developer approval required false",
    "Implement the Task Profile and R011 clarification sequentially, run one fresh independent review, remediate applicable findings, and run fresh final verification"
  ],
  "execution_strategy": {
    "implementation_subagents": false,
    "review_subagent": true,
    "workspace_isolation": true,
    "methodology_adapter": "superpowers"
  },
  "gates": {
    "reused": [
      "Approved Handoff Revision 1 requirement discovery, design, specification, intent, and strategy approval",
      "Compatible Codex Preflight against the exact isolated baseline",
      "Repository-grounded implementation plan",
      "Chat route evaluation CONTINUE_CURRENT_ROUTE at task revision 2"
    ],
    "repeated": [
      "Focused semantic checks after normative clarification",
      "Fresh independent review",
      "Fresh final repository verification"
    ]
  },
  "measurements": {
    "phase_timings": [],
    "clarification_loops": 0,
    "re_routes": [],
    "verification_failures": [],
    "developer_overrides": []
  },
  "preflight": {
    "outcome": "compatible",
    "adaptations": [],
    "conflicts": []
  },
  "review": {
    "status": "findings_remediated",
    "findings": [
      "Important: continuation wording initially required only approved-strategy validity and could bypass R011 when the active route alone was invalid; all affected guidance and Dogfood evidence now require both route and strategy to remain valid, and fresh re-review found no remaining Critical, Important, or boundary-relevant Minor issue."
    ]
  },
  "verification": {
    "status": "pass",
    "checks": [
      "Focused semantic scans confirm immediate route-impact evaluation, level-change non-trigger behavior, two-part continuation validity, and either-part R011 invalidation",
      "Fresh independent review and post-remediation re-review",
      "Complete workflow-integrity regression suite",
      "Complete repository verifier including schema conformance, Markdown links, terminology, routing rules, unresolved markers, and decision-value gates",
      "Independent parsing of every repository JSON file",
      "Exact nine-file changed inventory",
      "No schema, verifier, regression, Approved Handoff, Work State, Re-route Required, Conflict Report, bridge, or authority artifact change",
      "Unstaged and staged Git whitespace checks"
    ]
  },
  "findings": [
    {
      "type": "SEMANTIC_BOUNDARY",
      "area": "continue_current_route_guard",
      "description": "Initial clarification text allowed continuation when only the approved execution strategy remained valid, which could bypass R011 if the active route alone was invalidated.",
      "correction": "Required both the active route and approved execution strategy to remain valid for continuation, made invalidation of either enter R011, aligned Dogfood evidence, and obtained a clean fresh re-review.",
      "status": "remediated"
    }
  ],
  "developer_controls": [
    "Original Approved Handoff Revision 1 Task Profile evidence set parallelizability to low",
    "Planning-time repository evidence supported refreshing parallelizability from low to medium",
    "The unchanged dimensions are requirement_ambiguity, scope_complexity, repository_dependency, regression_risk, security_sensitivity, and context_uncertainty",
    "Chat evaluated the refreshed profile immediately and returned CONTINUE_CURRENT_ROUTE",
    "active_route_invalidated = false",
    "approved_strategy_invalidated = false",
    "Re-route Required count = 0",
    "developer reapproval count = 0",
    "Approved Handoff Revision 1 remains authoritative; no Approved Handoff Revision 2 was created solely for the evidence refresh",
    "No new Profile Changed artifact, lifecycle state, bridge, schema, or authority surface",
    "No implementation subagent",
    "No commit, push, pull request, merge, tag, release, or publication"
  ],
  "result": "pass",
  "observations": [
    "Stage 1 created an isolated worktree at the exact baseline, completed compatible Codex Preflight, and persisted the repository-grounded implementation plan before stopping for Chat route evaluation.",
    "The original Approved Handoff profile set parallelizability to low because implementation was expected to remain one sequential semantic unit.",
    "Planning discovered that the Task Profile and R011 core must stabilize sequentially, after which phase-owner guidance, recovery guidance, and final Dogfood evidence occupy disjoint files with focused independent checks.",
    "That concrete repository evidence refreshed parallelizability from low to medium without changing any other Task Profile dimension.",
    "Chat evaluated route impact at task revision 2 and returned CONTINUE_CURRENT_ROUTE because the revised profile invalidated neither the active route nor the approved architectural sequential strategy.",
    "Routing Recommendation Revision 2 records phase implementation, surface codex, matched rule R001, workflow approved_architectural_sequential_implementation, implementation subagents false, workspace isolation true, fresh independent review required, and developer approval required false.",
    "Implementation resumed from the existing implementation-planning checkpoint without repeating requirement discovery, design, Codex Preflight, or planning.",
    "The normative clarification separates evidence refresh from route invalidation: every profile revision receives immediate route-impact evaluation, the current route continues without developer reapproval or Re-route Required only while both route and strategy remain valid, and invalidation of either follows the existing Re-route Required lifecycle.",
    "No Re-route Required, Conflict Report, Approved Handoff Revision 2, Profile Changed artifact, new lifecycle state, bridge, schema, or authority surface was created.",
    "A fresh independent reviewer found one Important continuation-guard inconsistency; remediation required both route and strategy validity, and the same fresh review context confirmed no remaining Critical, Important, or boundary-relevant Minor issue.",
    "Fresh final verification passed after the Dogfood result, review evidence, verification evidence, and implementation-plan checklist were finalized."
  ],
  "next_action": "developer_review"
}
