{
  "$schema_file": "../schemas/dogfood-record.schema.json",
  "schema": "dogfood_record",
  "schema_version": "0.1",
  "record_type": "run",
  "task_id": "devswitchboard-orchestration-value-boundary-015",
  "revision": 2,
  "authority": [
    "DevSwitchboard Dogfood #015 Approved Handoff Revision 1 remains the intent and execution-strategy authority",
    "Chat task revision 2 returned NO_MORE_CONTEXT_NEEDED and CONTINUE_CURRENT_ROUTE after resource-value evaluation",
    "Exact baseline daaeea49692e256ca90f9105dd53723344e26a97"
  ],
  "approved_route": [
    "Reuse Approved Handoff Revision 1 requirement discovery, design, specification, intent, and execution-strategy authority",
    "Resume from the completed Codex Preflight, repository-grounded implementation plan, and Stage 1 resource-evaluation checkpoint",
    "Implement sequentially in the existing Codex context with implementation parallelism and bounded implementation delegation not selected",
    "Run one fresh independent non-authoring review and mandatory fresh final verification"
  ],
  "execution_strategy": {
    "implementation_subagents": false,
    "review_subagent": true,
    "workspace_isolation": true,
    "methodology_adapter": "superpowers"
  },
  "gates": {
    "reused": [
      "Approved Handoff Revision 1 requirement discovery, design, specification, intent, and strategy approval",
      "Compatible Codex Preflight against the exact isolated baseline",
      "Repository-grounded implementation plan and resource evaluation",
      "Chat task revision 2 NO_MORE_CONTEXT_NEEDED and CONTINUE_CURRENT_ROUTE decision"
    ],
    "repeated": [
      "Focused semantic checks after normative clarification",
      "Fresh independent review",
      "Fresh final repository verification"
    ]
  },
  "measurements": {
    "phase_timings": [],
    "clarification_loops": 0,
    "re_routes": [],
    "verification_failures": [],
    "developer_overrides": [],
    "decision_value_checks": [
      {
        "checkpoint_id": "DV-015-001",
        "decision": "NO_MORE_CONTEXT_NEEDED",
        "context_source": "NONE",
        "missing_fact": null,
        "material_to": [],
        "evidence": [
          "Stage 1 found no missing repository fact that could materially change the resource-value judgment, and Chat selected the resource route at task revision 2."
        ]
      }
    ]
  },
  "preflight": {
    "outcome": "compatible",
    "adaptations": [],
    "conflicts": []
  },
  "review": {
    "status": "findings_remediated",
    "findings": [
      "The local fresh independent non-authoring review originally found no Critical, Important, or boundary-relevant Minor findings and confirmed the eligibility/selection boundary, concrete value test, mandatory-confidence exception, developer authority, R007-R010 consistency, and absence of a new lifecycle or artifact.",
      "A later GitHub-side developer merge-gate audit found one boundary-relevant Minor: the actual NO_MORE_CONTEXT_NEEDED checkpoint was preserved only in prose; remediation added the canonical machine-readable DV-015-001 checkpoint."
    ]
  },
  "verification": {
    "status": "pass",
    "checks": [
      "Focused semantic scans confirm optional-resource eligibility is not selection, value requires concrete benefits to materially exceed named orchestration costs, and lower orchestration cannot suppress mandatory confidence work",
      "Fresh independent non-authoring review",
      "Complete workflow-integrity regression suite",
      "Complete repository verifier including JSON syntax, schema conformance, semantic invariants, Markdown links, terminology, routing rules, unresolved markers, decision-value gates, and verification invariants",
      "Independent parsing of all 60 repository JSON files",
      "Decision-value semantics confirm DV-015-001 uses context_source NONE, missing_fact null, and an empty material_to list for NO_MORE_CONTEXT_NEEDED",
      "Exact eight-file changed inventory with no schema, verifier, or regression changes",
      "Unstaged Git whitespace check plus direct whitespace validation for every changed and untracked file"
    ]
  },
  "findings": [
    {
      "type": "DECISION_VALUE_EVIDENCE",
      "area": "decision_value_checkpoint_measurement",
      "description": "The actual NO_MORE_CONTEXT_NEEDED checkpoint was recorded in prose but omitted from the canonical measurements.decision_value_checks surface.",
      "correction": "Added DV-015-001 with context_source NONE, missing_fact null, an empty material_to list, and the observed Stage 1 evidence.",
      "status": "remediated"
    }
  ],
  "developer_controls": [
    "Implementation parallelism: technically eligible = true; selected = false because plausible benefits did not materially exceed coordination, context-transfer, reconciliation, and integration costs",
    "Bounded implementation delegation: technically eligible = true; selected = false because incremental execution and confidence value did not materially exceed context-transfer, review, reconciliation, and integration costs",
    "Fresh independent review: technically eligible = true; selected = true because non-authoring contradiction detection has material value for this architectural and contract-heavy boundary",
    "Fresh final verification: selected = true; mandatory = true under R010 and existing v0.1 completion semantics",
    "Missing decision-changing fact = false; Chat returned NO_MORE_CONTEXT_NEEDED",
    "Chat returned CONTINUE_CURRENT_ROUTE and the approved strategy remained unchanged",
    "Implementation subagents remained false; implementation subagent count = 0",
    "Re-route Required count = 0",
    "Conflict Report count = 0",
    "Developer reapproval count = 0",
    "New resource-selection artifact count = 0",
    "No new bridge, lifecycle state, Task Profile dimension, or authority surface"
  ],
  "result": "pass",
  "observations": [
    "Stage 1 created the isolated worktree at the exact baseline, completed compatible Codex Preflight, preserved the repository-grounded implementation plan, evaluated four resource candidates independently, and stopped for Chat.",
    "Planning found downstream units that made implementation parallelism and bounded implementation delegation technically eligible, while also identifying material briefing, coordination, reconciliation, and integration costs.",
    "Chat task revision 2 found no missing decision-changing fact, returned NO_MORE_CONTEXT_NEEDED and CONTINUE_CURRENT_ROUTE, selected neither optional implementation resource, and preserved the approved strategy.",
    "Implementation resumed from the existing planning checkpoint without repeating requirement discovery, design, Codex Preflight, implementation planning, or resource-value context acquisition.",
    "The normative clarification separates optional resource eligibility from selection, value-gates parallel execution and delegation, preserves independently valuable fresh review, and prevents lower-orchestration reasoning from suppressing mandatory fresh final verification.",
    "No Orchestration Decision artifact, other resource-selection artifact, bridge, lifecycle state, schema, verifier, regression, Re-route Required, Conflict Report, or developer reapproval was created.",
    "The local fresh independent non-authoring reviewer originally reported no Critical, Important, or boundary-relevant Minor findings.",
    "A later GitHub-side developer merge-gate audit found one boundary-relevant Minor because the actual NO_MORE_CONTEXT_NEEDED checkpoint was prose-only; adding DV-015-001 remediated the finding without a schema or artifact change.",
    "Fresh final verification was rerun after the DV-015-001 evidence, review history, finding remediation, and implementation-plan history were finalized."
  ],
  "next_action": "developer_review"
}
